Title,Author,Price,Language,Publish Year,Publisher,Weight,Description,Image URL,Detail URL
Nguyên Lý Quản Trị Chuỗi Cung Ứng,Oscar Wilde,"159,200₫",Tiếng Việt,2023,Văn Học,460,null,https://product.hstatic.net/200000845405/product/8935251400182_9eb7a5f70afb46d981d99c8bde7271a8_master.jpg,https://www.vinabook.com/products/nguyen-ly-quan-tri-chuoi-cung-ung
Định Vị - Cuộc Chiến Giành Tâm Trí Khách Hàng (Tái Bản 2023),Oscar Wilde,"159,200₫",Tiếng Việt,2023,Văn Học,460,null,https://product.hstatic.net/200000845405/product/66_aaef3b69dab34b8e8a0f520eae865b2f_master.jpg,https://www.vinabook.com/products/dinh-vi-cuoc-chien-gianh-tam-tri-khach-hang-tai-ban-2023
Người Giàu Nhất Thành Babylon - The Richest Man In Babylon,Oscar Wilde,"90,000₫",Tiếng Việt,2023,Văn Học,460,null,https://product.hstatic.net/200000845405/product/8935235242401_a0bb761368024b8f80639c8978b89c5b_master.jpg,https://www.vinabook.com/products/nguoi-giau-nhat-thanh-babylon-the-richest-man-in-babylon
Kệ Hàng Trống - Đứt Gãy Chuỗi Cung Ứng Trong Nền Kinh Tế Toàn Cầu,Oscar Wilde,"144,000₫",Tiếng Việt,2023,Văn Học,460,"Kệ Hàng Trống - Đứt Gãy Chuỗi Cung Ứng Trong Nền Kinh Tế Toàn CầuKhủng hoảng chuỗi cung ứng đang đến hồi khốc liệt. Những sản phẩm bạn yêu thích không còn xuất hiện trên kệ hàng nữa: nó còn đang mắc kẹt đâu đó giữa Thái Bình Dương. Tình trạng gián đoạn chuỗi cung ứng này sẽ thế nào trong sáu tháng, hay thậm chí là ba năm nữa? Chúng ta vẫn kỳ vọng rằng các hành động phục hồi kinh tế và đời sống sau dịch bệnh sẽ giúp tháo gỡ các vấn đề này, nhưng thực tế là tiền số và mạng xã hội sẽ chẳng thể giải quyết được các vấn đề muôn thuở trong việc vận chuyển hàng hóa xuyên đại dương từ châu lục này đến châu lục khác. Theo James Rickards, sự bất mãn của người tiêu dùng trước tình trạng thiếu thốn hàng hóa chỉ là phần chóp của một tảng băng vô cùng lớn đang đe dọa nền kinh tế toàn cầu,Trong Kệ hàng trống, Rickards chia sẻ những dự đoán của bản thân ông về một nền kinh tế mới sau dịch bệnh, đồng thời chỉ cách cho người tiêu dùng và chủ doanh nghiệp đón đầu những khủng hoảng sắp tới. Bạn sẽ hiểu tại sao tình trạng thiếu năng lượng ở Trung Quốc có thể làm gián đoạn cả một ngành công nghiệp sản xuất thép, tại sao lạm phát sẽ nhanh chóng biến thành giảm phát, và mức chi tiêu của người tiêu dùng sẽ giảm mạnh do thuế cao, nợ chồng chất, và tình trạng thất nghiệp ngày càng lan rộng. Cuối cùng, tác giả nhìn vào tương lai của tiền tệ, một tương lai rất có thể sẽ không còn đồng đô la nữa.Nền kinh tế toàn cầu sẽ đối mặt với nhiều thử thách trong tương lai gần, và việc chúng ta chìm hay nổi trong cơn sóng dữ phụ thuộc vào việc ta tự trang bị cho mình tốt đến đâu và làm những gì để ngăn chặn cuộc sụp đổ sắp tới.",https://product.hstatic.net/200000845405/product/2024_07_29_17_13_09_1-390x510_314f685625234355ade52485b6104ba2_master.jpg,https://www.vinabook.com/products/ke-hang-trong-dut-gay-chuoi-cung-ung-trong-nen-kinh-te-toan-cau
Trải Nghiệm Khách Hàng Xuất Sắc (Tái Bản 2024),Oscar Wilde,"225,000₫",Tiếng Việt,2023,Văn Học,460,null,https://product.hstatic.net/200000845405/product/8935278608417_c5953c38799a4564a161c8406d6bc57f_master.jpg,https://www.vinabook.com/products/trai-nghiem-khach-hang-xuat-sac-tai-ban-2024
Thực Thi - Hoàn Thành Kế Hoạch Bằng Phương Pháp Quản Trị Có Nguyên Tắc,Oscar Wilde,"44,700₫",Tiếng Việt,2023,Văn Học,460,null,https://product.hstatic.net/200000845405/product/100_ae075bf374ea45c3aa6f4199b9957c1c_master.jpg,https://www.vinabook.com/products/thuc-thi-hoan-thanh-ke-hoach-bang-phuong-phap-quan-tri-co-nguyen-tac
Cách Mạng,Oscar Wilde,"128,000₫",Tiếng Việt,2023,Văn Học,460,"Mô tả sản phẩmCách Mạng được xuất bản ngày 24-11-2016, đã bán được gần 200.000 bản và là một trong những quyển sách bán chạy nhất nước Pháp trong năm 2016. Không phải ngẫu nhiên mà bản quyền dịch thuật cuốn sách này bán được cho hơn 20 quốc gia, một con số chưa từng có đối với một chính trị gia người Pháp.  Điều gì khiến cuốn sách nhỏ này hấp dẫn đến vậy?Ngày 14-5-2017, một người đàn ông mới 39 tuổi tuyên thệ trước điện Elysée trong buổi lễ nhậm chức Tổng thống Pháp. Đó chính là Emmanuel Macron, tổng thống thứ 25 và cũng là tổng thống trẻ nhất của nước Pháp từ trước đến nay.Cuộc đời riêng và sự nghiệp chính trị của Macron kể từ khi ông nổi lên từ cuộc chạy đua vào chức tổng thống đã trở thành tâm điểm của giới truyền thông. Xuất thân từ tỉnh lẻ, gia đình căn bản theo nghề y, không hề có truyền thống chính trị, cưới một người vợ là cô giáo của ông và hơn ông 24 tuổi, đã có 3 con riêng. Đam mê văn chương từ nhỏ, lớn lên theo học triết rồi lại chuyển hướng sang ngành hành chính công. Thế rồi đột ngột từ bỏ lĩnh vực hành chính công để theo đuổi một sự nghiệp rất thành công trong lĩnh vực tài chính ngân hàng. Sau đó tham gia vào chính phủ của Tổng thống François Hollande, làm Phó Tổng Thư ký Văn phòng Tổng thống rồi Bộ trưởng Bộ Kinh tế, Công nghiệp và Kỹ thuật số.Vậy phải thay đổi những gì để làm được một cuộc cách mạng dân chủ sâu sắc? Tân Tổng thống Pháp, trong hơn 250 trang sách đã đưa ra những kiến giải và giải pháp về tất cả các lĩnh vực của đời sống: từ việc làm, kinh tế, giáo dục, y tế, an sinh xã hội, đến môi trường, ngoại giao, quân sự và cải tổ cơ cấu hành chính. Đặc biệt, một quan điểm xuyên suốt của Macron trong Cách mạng là số mệnh nước Pháp gắn liền với khả năng hồi phục sức mạnh của Liên minh châu Âu: “Chúng ta sẽ chỉ có thể thành công với hai điều kiện. Một là phát triển lại mô hình châu Âu, đây là cơ hội của chúng ta trong bối cảnh toàn cầu hóa. Hai là lấy lại niềm tin vào chính mình”. Và không chỉ nói suông, trong cuốn sách này, ông thật sự đã vạch ra một viễn cảnh rõ ràng để hồi phục Liên minh châu Âu.",https://product.hstatic.net/200000845405/product/cach_906cfdf38b944f06bc565e01da8837d9_master.jpg,https://www.vinabook.com/products/cach-mang
Mega Livestream – Bề Nổi Tảng Băng Chìm,Oscar Wilde,"80,100₫",Tiếng Việt,2023,Văn Học,460,null,https://product.hstatic.net/200000845405/product/90_8b253d669e2343fab2dcc0dd4f7e65a5_master.jpg,https://www.vinabook.com/products/mega-livestream-be-noi-tang-bang-chim
Kinh Thánh Về Nghệ Thuật Bán Hàng (Tái Bản 2023),Oscar Wilde,"206,100₫",Tiếng Việt,2023,Văn Học,460,null,https://product.hstatic.net/200000845405/product/8935251419153_1_5a2c0e8817bc47e8b216c576404aac82_master.jpg,https://www.vinabook.com/products/kinh-thanh-ve-nghe-thuat-ban-hang-tai-ban-2023
Doanh Nghiệp Cống Hiến,Oscar Wilde,"223,200₫",Tiếng Việt,2023,Văn Học,460,null,https://product.hstatic.net/200000845405/product/8935235242241_9408516643964cec88fe46eccd53efa1_master.jpg,https://www.vinabook.com/products/doanh-nghiep-cong-hien
Rule #1 - Quy Tắc Số 1,Oscar Wilde,"179,100₫",Tiếng Việt,2023,Văn Học,460,null,https://product.hstatic.net/200000845405/product/quy-tac-so-1_6.6_1f37607570b74b9d8410519fa654e8cd_master.jpg,https://www.vinabook.com/products/rule-1-quy-tac-so-1
Con Bò Tía (Tái Bản 2023),Oscar Wilde,"152,100₫",Tiếng Việt,2023,Văn Học,460,null,https://product.hstatic.net/200000845405/product/8935251420425_1bb08866955544d7b40702edf9dab904_master.jpg,https://www.vinabook.com/products/con-bo-tia-tai-ban-2023
Vui Cười Lên Cùng Chứng Khoán,Oscar Wilde,"134,100₫",Tiếng Việt,2023,Văn Học,460,null,https://product.hstatic.net/200000845405/product/8935251421804_293d7a7190d04f94a39b91e6bb7b67af_master.jpg,https://www.vinabook.com/products/vui-cuoi-len-cung-chung-khoan
Nghệ Thuật Quản Lý Nhân Sự,Oscar Wilde,"79,200₫",Tiếng Việt,2023,Văn Học,460,"Tài sản quý nhất của các doanh nghiệp chính là con người - Matsushita Konosuke Cách dùng người hiệu quả không chỉ ở chỗ làm mọi cách để hạn chế nhược điểm, mà quan trọng là biết cách phát huy những ưu điểm của họ. - Peter Ferdinand Drucker Một công ty muốn phát triển nhanh thì phải giỏi trong việc tìm ra nhân tài, đặc biệt là những nhân tài thông minh.- Bill Gates Là người lãnh đạo, muốn quản lý thành công và hiệu quả, phải có niềm tin kiên định và phương pháp rõ ràng trong việc tuân thủ nguyên tắc quản lý. Mỗi khi nắm bắt được vấn đề cốt lõi của việc quản lý: cách dùng người, phát hiện tài năng, bồi dưỡng tính tự giác, độc lập cho nhân viên, tạo điều kiện để họ phát huy sở trường là bạn đã thể hiện được kỹ năng cũng như nghệ thuật quản lý.Nghệ Thuật Quản Lý Nhân Sự trình bày dễ hiểu những điểm quan yếu nhất trong phương pháp quản lý nhân sự: cách ra lệnh, chọn giải pháp, giải quyết trở ngại, đề xuất thưởng phạt, khích lệ nhân viê kèm theo những ví dụ cụ thể thường xảy ra trong thực tế. Vận dụng tinh tế, đúng lúc những phương pháp này, bạn sẽ nắm được bí quyết quản lý, dễ dàng tạo dựng thành công cho cá nhân lẫn doanh nghiệp.",https://product.hstatic.net/200000845405/product/image_228479_1455b2d8d8924dc58b84ef2d32a21af2_master.jpg,https://www.vinabook.com/products/nghe-thuat-quan-ly-nhan-su
6 Bí Quyết Quản Lý Dự Án Hiệu Quả,Oscar Wilde,"58,500₫",Tiếng Việt,2023,Văn Học,460,"6 Bí Quyết Quản Lý Dự Án Hiệu QuảCàng nhiều thời gian rảnh thì công việc sẽ càng nhiều để lấp đầy khoảng thời gian đó- Định luật ParkinsonHướng dẫn các kỹ năng quản lý dự án cần thiết, giúp bạn thực hiện các dự án ĐÚNG THỜI HẠN – ĐỦ NGÂN SÁCH:Thực tế, dễ đọc, không có biệt ngữ chuyên ngànhHướng dẫn từng bước và các điểm hành độngCác mẹo hiệu quả, dễ áp dụngCác sai lầm thường gặp và lời khuyên về cách tránh chúngTóm tắt các ý chính để bạn có thể dễ dàng ghi nhớViệc sắp xếp tất cả nhiệm vụ và nguồn lực cần thiết để vận hành suôn sẻ một dự án có vẻ là nhiệm vụ khó khăn – từ việc tham gia cùng các bên liên quan và xác định phạm vi đặc điểm kỹ thuật đầy đủ của dự án, đến việc kiểm soát chi phí và bám sát lịch trình.6 BÍ QUYẾT QUẢN LÝ DỰ ÁN HIỆU QUẢ đưa ra những lời khuyên thiết thực trong việc quản lý dự án, giúp bạn luôn bình tĩnh, thiết lập các công việc theo thứ tự ưu tiên, giao tiếp với người khác, theo dõi tiến độ và ứng phó với các sự kiện bất ngờ.",https://product.hstatic.net/200000845405/product/8935074134837_ff5d4c53a550463e875805db11e00cfc_master.jpg,https://www.vinabook.com/products/6-bi-quyet-quan-ly-du-an-hieu-qua
Lãnh Đạo Bằng Lòng Biết Ơn,Oscar Wilde,"112,500₫",Tiếng Việt,2023,Văn Học,460,null,https://product.hstatic.net/200000845405/product/8934974200819_ac14c1b4628f4df2b19b3927baf8e970_master.jpg,https://www.vinabook.com/products/lanh-dao-bang-long-biet-on
Vươn Lên Từ Đáy - Hành Trình Tái Hiện Giấc Mơ Mỹ,Oscar Wilde,"193,500₫",Tiếng Việt,2023,Văn Học,460,null,https://product.hstatic.net/200000845405/product/8934974201106_7211232daf0443aeb60ca8161c6fcef5_master.jpg,https://www.vinabook.com/products/vuon-len-tu-day-hanh-trinh-tai-hien-giac-mo-my
Vượt Xa Kỹ Thuật Số - Beyond Digital,Oscar Wilde,"211,500₫",Tiếng Việt,2023,Văn Học,460,null,https://product.hstatic.net/200000845405/product/8935280401136_0faceba178d44386bbdda0f497cc8de3_master.jpg,https://www.vinabook.com/products/vuot-xa-ky-thuat-so-beyond-digital
Great Ted Talks: Thuật Lãnh Đạo - Đương Đầu Thử Thách,Oscar Wilde,"125,100₫",Tiếng Việt,2023,Văn Học,460,null,https://product.hstatic.net/200000845405/product/8935325004711_b1d5eaf59d244ff6b91848c0a2f151c6_master.jpg,https://www.vinabook.com/products/great-ted-talks-thuat-lanh-dao-duong-dau-thu-thach
Chiến Lược Đầu Tư Chứng Khoán,Oscar Wilde,"152,100₫",Tiếng Việt,2023,Văn Học,460,null,https://product.hstatic.net/200000845405/product/image_232600_8c0680a5b27f458e8dde1d93f917dd60_master.jpg,https://www.vinabook.com/products/chien-luoc-dau-tu-chung-khoan
Điều Kỳ Diệu Của Lòng Hiếu Khách,Oscar Wilde,"206,100₫",Tiếng Việt,2023,Văn Học,460,null,https://product.hstatic.net/200000845405/product/8935251417951_d4f495930d8447e4b4b34a11e3b06a7d_master.jpg,https://www.vinabook.com/products/dieu-ky-dieu-cua-long-hieu-khach
Nghề Nhân Sự Việt: Góc Nhìn Từ Bên Trong - Hành Trình Phát Triển Cùng Con Người Và Tổ Chức,Oscar Wilde,"170,100₫",Tiếng Việt,2023,Văn Học,460,null,https://product.hstatic.net/200000845405/product/8935251421002_0de5c0e875c44dffb5de6ec6d76e91cd_master.jpg,https://www.vinabook.com/products/nghe-nhan-su-viet-goc-nhin-tu-ben-trong-hanh-trinh-phat-trien-cung-con-nguoi-va-to-chuc
Thấu Hiểu Marketing Đại Học (Sdv),Oscar Wilde,"179,100₫",Tiếng Việt,2023,Văn Học,460,null,https://product.hstatic.net/200000845405/product/29_e1d23c60e26243af9b57c39515863788_master.jpg,https://www.vinabook.com/products/thau-hieu-marketing-dai-hoc-sdv
Lập Kế Hoạch Kinh Doanh Cho Người Mới Bắt Đầu,Oscar Wilde,"107,100₫",Tiếng Việt,2023,Văn Học,460,null,https://product.hstatic.net/200000845405/product/l_p-k_-ho_ch-kd-cho-ng_i-m_i-b_t-_u_e3bca0d26cb44f80be3ec7ff62d033e8_master.jpg,https://www.vinabook.com/products/lap-ke-hoach-kinh-doanh-cho-nguoi-moi-bat-dau
Dặm Đường Tôi Đi_Tbl2 (Sdv),Oscar Wilde,"175,500₫",Tiếng Việt,2023,Văn Học,460,null,https://product.hstatic.net/200000845405/product/9786043107906_25bab34b79dd48ebbf29a81a92e8cdc2_master.jpg,https://www.vinabook.com/products/dam-duong-toi-di-tbl2-sdv
The First Tycoon - Tài Phiệt Đầu Tiên Của Nước Mỹ Vanderbilt (Bc),Oscar Wilde,"449,100₫",Tiếng Việt,2023,Văn Học,460,null,https://product.hstatic.net/200000845405/product/c_t-_o-b_a-vanderbilt-t_i-phi_t-_u-ti_n-c_a-n_c-m__1_5256679d82184660b58d80f4eb61299a_master.jpg,https://www.vinabook.com/products/the-first-tycoon-tai-phiet-dau-tien-cua-nuoc-my-vanderbilt-bc
Tâm Lý Thị Trường Chứng Khoán,Oscar Wilde,"89,100₫",Tiếng Việt,2023,Văn Học,460,null,https://product.hstatic.net/200000845405/product/c_t-t_m-l_-th_-tr_ng-ch_ng-kho_n_59e8ddce7906479d9c715aa5ec653303_master.jpg,https://www.vinabook.com/products/tam-ly-thi-truong-chung-khoan
Những Ngộ Nhận Về Xây Dựng Thương Hiệu3,Oscar Wilde,"169,200₫",Tiếng Việt,2023,Văn Học,460,null,https://product.hstatic.net/200000845405/product/upload_98b89c6dd35f4325875ca46c4f4099fb_master.jpg,https://www.vinabook.com/products/nhung-ngo-nhan-ve-xay-dung-thuong-hieu3
Tiny Habits : Thói Quen Tí Hon - Tiềm Năng Khổng Lồ,Oscar Wilde,"299,000₫",Tiếng Việt,2023,Văn Học,460,,https://product.hstatic.net/200000845405/product/9_b226ab465da84b67be46fce0647fc51a_master.jpg,https://www.vinabook.com/products/tiny-habits-thoi-quen-ti-hon-tiem-nang-khong-lo
Thuật Lãnh Đạo Nơi Công Sở - How To Manage Problem Employees,Oscar Wilde,"249,000₫",Tiếng Việt,2023,Văn Học,460,,https://product.hstatic.net/200000845405/product/1_c4905682a1544446a083175bd257e8a2_master.jpg,https://www.vinabook.com/products/thuat-lanh-dao-noi-cong-so-how-to-manage-problem-employees
Cách Thức Kinh Doanh Và Đầu Cơ Cổ Phiếu! – How to Trade in Stocks,Oscar Wilde,"349,000₫",Tiếng Việt,2023,Văn Học,460,,https://product.hstatic.net/200000845405/product/0c68200117405a83da81e2fa5ae629_5546b2ce3f634aec8471f430466868f8_master_16f4c07bcc6940d485b1598dbafe98cc_master.png,https://www.vinabook.com/products/cach-thuc-kinh-doanh-va-dau-co-co-phieu-how-to-trade-in-stocks
Con Đường Đi Đến Sự Giàu Có - The Simple Path To Wealth,Oscar Wilde,"299,000₫",Tiếng Việt,2023,Văn Học,460,,https://product.hstatic.net/200000845405/product/artboard_104_1f4a303453fd41a790648cb608b87628_master_64b8064095ca4092992156d464fbea79_master.png,https://www.vinabook.com/products/con-duong-di-den-su-giau-co-the-simple-path-to-wealth
Damn Right! - Vén màn bí ẩn về tỷ phú Charlie Munger,Oscar Wilde,"299,000₫",Tiếng Việt,2023,Văn Học,460,,https://product.hstatic.net/200000845405/product/49529c097441a19dff88593a2e9e49_a1d7b619a8cc4eadb81ad43c865d56b8_master_e3bd605630fe48ac99c09d5964505ac6_master.png,https://www.vinabook.com/products/damn-right-ven-man-bi-an-ve-ty-phu-charlie-munger
Lạc Quan Tếu – Irrational Exuberance,Oscar Wilde,"299,000₫",Tiếng Việt,2023,Văn Học,460,,https://product.hstatic.net/200000845405/product/artboard_19_5df189746ccf4bc4a0937443d49f05ba_master_430934cf8afe4192af64ab91b116d5a4_master.png,https://www.vinabook.com/products/lac-quan-teu-irrational-exuberance
Điều Quan Trọng Nhất,Oscar Wilde,"299,000₫",Tiếng Việt,2023,Văn Học,460,,https://product.hstatic.net/200000845405/product/u-quan-trong-nhat-happy-live-2_3793448dbf6a451cb4232ab09b6a9d71_master_120c29b5350d4b3b9b83ee4ee0f31273_master.jpg,https://www.vinabook.com/products/dieu-quan-trong-nhat
Người Đàn Ông Đánh Bại Mọi Thị Trường,Oscar Wilde,"349,000₫",Tiếng Việt,2023,Văn Học,460,,https://product.hstatic.net/200000845405/product/artboard_23_3f54532ca08042ef944df3e46d6cd948_master_0025469a5897499b992fb5df6a9b07cc_master.png,https://www.vinabook.com/products/nguoi-dan-ong-danh-bai-moi-thi-truong
Lột Xác Để Trở Thành Nhà Đầu Tư Giá Trị,Oscar Wilde,"268,000₫",Tiếng Việt,2023,Văn Học,460,"MÔ TẢLột xác để trở thành nhà đầu tư giá trị là câu chuyện về cuộc hành trình của Guy Spier và những điều ông đã học được trên con đường đầu tư của mình giúp ông giác ngộ được giá trị thực sự của việc đầu tư.Xuyên suốt quá trình đọc sách, độc giả và cũng là những nhà đầu tư hoặc yêu thích công việc đầu tư sẽ thực sự trải nghiệm hành trình lột xác thực sự của Guy Spier từ một tay “mafia” cò mồi tại một quỹ đầu tư chuyên kinh doanh các cổ phiếu “rác”. Tới việc trở thành một nhà đầu tư giá trị chân chính được soi sáng bởi trí tuệ của Warren Buffet và Charlie Munger.Hành trình ấy vốn rất gian khó với nhiều người, tuy nhiên thông qua câu văn và lời chia sẻ thành thật của Guy Spier, quý độc giả sẽ nhận thấy quá trình chuyển hóa và học hỏi trở thành một nhà đầu tư giá trị chưa bao giờ chân thực và giản đơn đến thế!Tác giả Guy Spier bắt đầu sự nghiệp của mình với tư cách là một Wannabe Gordon Gekko (nhân vật chính của bộ phim Wall Street) - gian manh, thiển cận, và hoàn toàn vị kỷ. Một tay sinh viên cao ngạo, tự phụ tốt nghiệp Oxford và MBA Harvard danh giá làm việc tại một ngân hàng đầu tư ở Phố Wall.Phố Wall nơi mà ma lực của đồng tiền đã khiến cả những người khôn ngoan, cần mẫn nhất cũng phải nhúng chàmGần 2 năm ròng rã tại D. H. Blair đã làm vấy bẩn hồ sơ đẹp đẽ của Guy Spier và đẩy sự nghiệp của ông xuống bờ vực thẳm. Điều tối kỵ trong kinh doanh, đặc biệt là giới đầu tư, khi danh tiếng là tất cả…Guy Spier đã tìm thấy chiếc phao cứu sinh của đời mình khi khám phá ra thế giới của Warren Buffett. Tiếp đến là một loạt những biến đổi và quá trình tự nhận thức dẫn dắt ông trên con đường từ Nhà đầu tư thông minh Benjamin Graham đến những triết lý đầu tư vĩ đại của Charlie Munger trong cuốn Poor Charlie’s Almanack (Tạm dịch: Niên giám Charlie khó nghèo). Tiếp đó là cuộc gặp với Mohnish Pabrai và bữa ăn trưa cùng Warren Buffett. Bữa ăn được đánh đổi bằng 650.100 đô la ấy đã có một tác động đổi đời đối với Guy Spier.Cũng trên hành trình này, ông gặt hái được nhiều triết lý thâm sâu về đầu tư và kinh doanh, đó là:- Tại sao người cố vấn và hình mẫu noi theo lại đóng vai trò quan trọng giống như chìa khóa của nhà đầu tư để đạt thành công trong dài hạn.- Kiến thức học thuật từ nền giáo dục hàng đầu có thể cản trở bạn như thế nào?- Tại sao tự học lại quan trọng trong hành trình trở thành nhà đầu tư vĩ đại.- Cách Buffett nghiệm ra được mục tiêu cuối cùng trong đời là sống thật với chính mình.",https://product.hstatic.net/200000845405/product/artboard_20_58b1ec761dd54ba9a2aa95c3f71e4933_master_c521c8c0259c47a9a20a85cae4689cc8_master.png,https://www.vinabook.com/products/lot-xac-de-tro-thanh-nha-dau-tu-gia-tri
Nghệ Thuật Đầu Tư Dhandho,Oscar Wilde,"238,000₫",Tiếng Việt,2023,Văn Học,460,"MÔ TẢKhi nhắc tới đầu tư giá trị, chúng ta không thể không nhắc đến người đàn ông lỗi lạc, người được ví như một “Warren Buffett đời thứ hai”, đó là Mohnish Pabrai - tác giả quyển sách Nghệ thuật đầu tư Dhandho.Thuộc diện sinh sau đẻ muộn lại không được đào tạo bài bản về tài chính nhưng nhưng Mohnish Pabrai đã trở thành một nhà đầu tư vô cùng thành công. Ông được xếp vào hàng ngũ những nhà đầu tư giá trị nổi danh thế hệ mới cùng Phil Town, Guy Spier, Seth Klarman,... những con người kế thừa một cách xuất sắc phương pháp đầu tư của các bậc “tiền bối” Benjamin Graham, Warren Buffett và Charlie Munger.Mohnish được biết tới bởi cách tiếp cận cực kỳ thành công trong dài hạn với thành tích đáng nể: Đạt lãi kép tới 18.8%/năm suốt giai đoạn khó khăn của thị trường chứng khoán Hoa Kỳ từ 1999-2008 (thị trường chung chỉ mang lại mức lợi nhuận khoảng 1%) và biến 1 triệu đô la ban đầu của trong quỹ đầu tư của mình (năm 1999) tăng trưởng thành 400 triệu đô la.Lối tiếp cận truyền thống của hầu hết các nhà đầu tư trên thực tế luôn là “Rủi ro cao, lợi nhuận cao” nhưng với Mohnish Pabrai thì không nhất thiết phải như vậy. “Rủi ro thấp, lợi nhuận cao” đó là tất cả những gì Mohnish Pabrai tìm kiếm.Ngửa thì tôi thắng, sấp thì tôi chẳng thiệt bao nhiêuMohnish Pabrai thông qua cuốn sách nổi tiếng của mình - Nghệ Thuật Đầu Tư Dhandho sẽ từng bước chỉ ra cho chúng ta những đặc điểm và cách thức đầu tư mà ông đã áp dụng rất hiệu quả trong thực tế. Và thật là may mắn những “túi khôn” và trí tuệ của Mohnish sẽ đến và đi thẳng vào đầu chúng ta bằng lối viết và kể chuyện đơn giản, dễ hiểu.“Ngửa thì tôi thắng, sấp thì tôi chẳng thiệt bao nhiêu” đó chính là nguyên tắc lặp đi lặp lại trong cuốn sách thông qua hàng loạt các thí dụ về những ngành nghề, những doanh nhân, và những cơ hội kinh doanh khác nhau. Bạn sẽ hiểu được nguyên nhân vì sao những người Patel, một dân tộc thiểu số Ấn Độ di cư sang Mỹ năm 1970, với số dân vô cùng ít ỏi, lại có thể vươn lên chiếm tới 50% thị phần ngành nghề kinh doanh nhà nghỉ (Motel) tại Mỹ, vì sao doanh nhân Richard Branson lại đạt được thành công lớn với tập đoàn Virgin, vì sao “Vua” thép Ấn Độ Lakshmi Mittal lại là ông hoàng trong lĩnh vực của mình.",https://product.hstatic.net/200000845405/product/artboard_22_49d05e230ca14117b18da10bbac7568e_master_39747c8d58d046149c3c14a965b75f37_master.png,https://www.vinabook.com/products/nghe-thuat-dau-tu-dhandho
