Title,Author,Price,Language,Publish Year,Publisher,Weight,Description,Image URL,Detail URL
Người Giàu Có Nhất Thành Babylon,George Samuel Clason,"88,000₫",Tiếng Việt,10/01/2024,Nxb văn học,230.00 gam,"Người Giàu Có Nhất Thành BabylonThành cổ Babylon được biết đến là nơi khởi minh rực rỡ nhất thời cổ đại, nơi có những thành quách đồ sộ, dân cư đông đúc và các hoạt động giao thương diễn ra nhộn nhịp. Vậy, những người ở Babylon đã làm thế nào để trở thành thương gia, làm thế nào để trở thành người giàu nhất? Điều gì đã khiến họ có thể làm chủ vận mệnh và làm chủ tài chính khi chỉ là những nô lệ thấp kém?Cuốn sách Người giàu có nhất thành Babylon sẽ mang đến cho độc giả những câu chuyện về bí mật của sự giàu có, được kể qua lời của những nô lệ, thương gia, thợ thuyền đến từ 4.000 năm trước.Họ sẽ tiết lộ cho bạn những nguyên tắc quan trọng để sở hữu tiền - vàng và tăng sinh lợi nhuận từ số vốn ban đầu. Nếu bạn đang tìm kiếm sự giàu có, hãy nhớ rằng, tiền không được phép đứng yên, nó phải tham gia vào dòng chảy thị trường, tạo ra lợi ích cho chủ sở hữu. Những phương pháp này sẽ khiến bạn phải bất ngờ vì nó không khó khăn, vô cùng đơn giản nhưng lại dễ dàng bị bỏ qua hoặc vô tình lãng quên đi mất tính căn bản của việc làm giàu.Cuốn sách Người giàu có nhất thành Babylon được viết bởi George Samuel Clason - doanh nhân thành công với Clason Map và Clason Publishing. Clason Map là nơi cho ra đời bản đồ giao thông đầu tiên của Hoa Kỳ và Canada, sau đó phá sản trong cuộc Đại khủng hoảng. Năm 1926, George Samuel Clason bắt đầu xuất bản những câu chuyện của mình, chúng được các chủ doanh nghiệp và những ai muốn thành công trong việc làm giàu hào hứng đón nhận.",https://product.hstatic.net/200000845405/product/p98276mng____i_a3bbeace14194526b05e5295d0e25fbc_master.jpg,https://www.vinabook.com/products/nguoi-giau-co-nhat-thanh-babylon-3-3
Bill Gates - Tham Vọng Lớn Lao  Quá Trình Hình Thành Đế Chế Microsoft,Oscar Wilde,"224,100₫",Tiếng Việt,2023,Văn Học,460,null,https://product.hstatic.net/200000845405/product/p98122mp85368mscan0001_4f388bc7b83244a79fbb738edd003137_master.jpg,https://www.vinabook.com/products/bill-gates-tham-vong-lon-lao-qua-trinh-hinh-thanh-de-che-microsoft-1
Phân Tích Dòng Tiền Trong Đầu Tư Bất Động Sản,Từ Viễn,"175,500₫",Tiếng ViệtĐịnh dạng: Bìa mềmKích thước: 20.5 x 13 x 1.9 cm cmNgày phát hành: 17/11/2023Số trang: 385,17/11/2023,NXB Công Thương,500.00 gam,"Phân Tích Dòng Tiền Trong Đầu Tư Bất Động SảnĐối với những người dân bình thường, ngôi nhà là tài sản quan trọng hàng đầu. Vì vậy, quyết định mua nhà sẽ ảnh hưởng trực tiếp đến một gia đình trong thời gian dài. Cuốn sách Phân tích dòng tiền trong đầu tư bất động sản giúp chúng ta phân biệt rõ sự thật với những lầm tưởng phổ biến trong hoạt động đầu tư bất động sản. Nếu bạn mua đúng cách, khối tài sản của bạn sẽ được cải thiện đáng kể; nhưng nếu đưa ra quyết định sai lầm, bạn sẽ rơi xuống hố chôn tiền. Vậy, làm thế nào để đưa ra được quyết định sáng suốt xung quanh việc mua nhà? Bạn nên mua nhà khi nào, ở đâu và như thế nào? Những thắc mắc lớn nhất xung quanh việc đầu tư bất động sản sẽ được giải đáp trong cuốn sách trên tay bạn.Nội dung chính trong sách:Phần 1: Những nhầm lẫn phổ biến về giá nhà caoPhần 2: Phân tích cơ bản về giá nhà: Công thức tính tốc độ tăng giá nhàPhần 3: Phân tích chính sách về giá nhà: Thị trường nhà ở trong tương laiPhần 4: Kim chỉ nam khi phân bổ bất động sản: Những lưu ý khi mua nhà và thuê nhàPhần 5: Lời gợi ý từ các đô thị lớn trên quốc tế: Xu hướng giá nhà trong tương laiPhần 6: Những hố sâu trong đầu tư bất động sảnPhần 7: Một số vấn đề trong giao dịch bất động sảnPhần 8: Sự phân bổ tài sản và giá nhà caoPhần 9: Tác hại của giá nhà caoPhần 10: Cục diện phân hóa bất động sảnVề tác giảTừ Viễn là Phó giáo sư Tài chính, thuộc Viện nghiên cứu Phát triển Quốc gia, Đại học Bắc Kinh. Năm 2005, ông nhận bằng Tiến sĩ Kinh tế của Đại học Duke. Ông từng đảm nhận công việc tại Đại học McGill ở Canada và Đại học Hồng Kông. Từ năm 2009 tới nay, ông làm công tác giảng dạy và nghiên cứu tại Viện nghiên cứu Phát triển Quốc gia của Đại học Bắc Kinh. Các nghiên cứu của ông tập trung vào kinh tế học tài chính, kinh tế vĩ mô và thị trường tài chính Trung Quốc.",https://product.hstatic.net/200000845405/product/p98015mphan_3982f70b08214bee800d461c75da99e6_master.jpg,https://www.vinabook.com/products/phan-tich-dong-tien-trong-dau-tu-bat-dong-san
Elon Musk Và Cuộc Cách Mạng Tài Chính Toàn Cầu,Jimmy Soni,"224,100₫",Tiếng ViệtĐịnh dạng: Bìa mềmKích thước: 24 x 16 x 2.4 cm cmNgày phát hành: 16/11/2023Số trang: 488,16/11/2023,NXB Công Thương,600.00 gam,"Elon Musk Và Cuộc Cách Mạng Tài Chính Toàn CầuNgày nay, Elon Musk, Peter Thiel, Max Levchin… được coi là những nhà tiên phong của ngành công nghệ. Tuy nhiên, câu chuyện về nơi họ bắt đầu hầu như không được kể đến. Trước khi thành lập, tài trợ và tư vấn cho các công ty hàng đầu thế giới, bao gồm Tesla, Facebook, YouTube, SpaceX, và LinkedIn, họ là những nhà sáng tạo vô danh của một công ty khởi nghiệp thanh toán trực tuyến nhỏ bé có tên là PayPal.Cuốn sách này sẽ khám phá những ngày đầu đầy sóng gió ấy, tìm hiểu câu chuyện về về một nhóm thanh niên tài năng, nhiệt huyết đã tập hợp cùng nhau trong những ngày đầu của internet như thế nào, và thành tựu của họ đã định hình thế giới ngày nay—các công ty khởi nghiệp kỹ thuật số, tài chính không dùng tiền mặt, chuyển tiền điện tử và thay đổi thế giới của chúng ta mãi mãi ra sao.Bạn đọc sẽ được chứng kiến hành trình về câu chuyện của công ty PayPal, từ những lần thất bại cho đến sự thành công như ngày nay. Đây là cuốn sách về một ví dụ của thành công, nhưng không tạo gánh nặng cho người đọc bằng những “bài học”. Có một thông điệp quan trọng vượt ngoài cả những bài học về tiền bạc, kinh doanh và cạnh tranh trên thương trường trong cuốn sách. Đó là: Cuộc sống của chúng ta sẽ được định hình bởi những thứ ta tạo ra và những người đồng hành sáng tạo cùng ta. Câu chuyện của PayPal không chỉ là về việc mọi người kết hợp với nhau để tạo nên một sản phẩm – mà còn về cách nhóm cùng nhau định hình chính con người của họ. Những người sáng lập và nhân viên đầu tiên của công ty đã thúc đẩy và yêu cầu nhau phát triển hơn mỗi ngày; để viết nên một dạng câu chuyện cổ tích trong Thung lũng Silicon – Thung lũng điện tử.Về tác giả:Jimmy Soni là một tác giả từng đoạt nhiều giải thưởng. Cuốn sách Elon Musk và cuộc cách mạng tài chính toàn cầu là cuốn sách bán chạy nhất toàn nước Mỹ và nhận được nhiều lời khen ngợi từ The New York Times, Wall Street Journal, New Yorker, The Economist, Financial Times,…",https://product.hstatic.net/200000845405/product/p98006mel_c8ad3773e3524b14aa55060d443c1e06_master.jpg,https://www.vinabook.com/products/elon-musk-va-cuoc-cach-mang-tai-chinh-toan-cau
Tạo Fan Thương Hiệu - Chốt Triệu Đơn Hàng,Laura Sicola,"134,100₫",Tiếng ViệtĐịnh dạng: Bìa mềmKích thước: 19 x 13 x 1.2 cm cmNgày phát hành: 20/09/2023Số trang: 240,20/09/2023,NXB Công Thương,360.00 gam,"Tạo Fan Thương Hiệu - Chốt Triệu Đơn HàngTrước hiện thực thị trường bị thu hẹp và khách hàng thắt chặt chi tiêu, phương pháp bán hàng ồ ạt nhắm đến doanh số cao không còn là phương án tối ưu, thay vào đó là việc xây dựng tệp khách hàng trung thành với sức mua ổn định. Để làm được điều đó không chỉ dựa vào chiến lược kinh doanh của công ty mà còn từ sức mua từ đội ngũ bán hàng. Hiromi Wada, người được mệnh danh là “nhà tư vấn bán hàng tạo nên doanh số tuyệt vời” ở Nhật Bản sẽ chỉ cho bạn bí quyết xây dựng thương hiệu cá nhân cho chính saler, để biến khách hàng thành người hâm mộ và tiếp tục ủng hộ mua. Bạn sẽ nhận ra “sức mạnh và lợi thế không ngờ của chính mình”, cũng như cách thức duy trì “fan thương hiệu” trong tương lai.Cuốn sách này sẽ chỉ cho bạn biết bản chất quan trọng thực sự của kinh doanh không phải con số doanh thu, mà là cảm tình của khách hàng.Trích dẫn hay trong sách:- Tất cả thành công không đến từ năng lực của chính bản thân mà nhờ sự ủng hộ của chính những người hâm mộ. Vì vậy, coi trọng những người hâm mộ đã luôn yêu mến và ủng hộ mình lâu dài thay vì theo đuổi những điều mới lạ đó sẽ tạo nên một tương lai tốt đẹp và ý nghĩa hơn. Nó không còn là sự cạnh tranh và giành giật lợi nhuận mà là sự cổ vũ, ủng hộ và giúp đỡ lẫn nhau. Nó là một tương lai với sự thân thiện và tình người.- Từ những điều nhỏ nhặt như việc nhớ tên khách hàng, trò chuyện với họ, chúng ta có thể làm cho họ trở thành fan, khách quen và từ đó thương hiệu cũng như tiếng tăm của doanh nghiệp sẽ được lan truyền qua lời giới thiệu của khách hàng, dần dần lượng khách hàng mới cũng sẽ tăng lên.- Cuộc chiến giành khách hàng trong tương lai sẽ được thực hiện thông qua việc khách hàng mua đi mua lại sản phẩm hoặc dịch vụ của bạn nhiều lần, khi mà dân số và mức độ tiêu dùng suy giảm. Điều này có nghĩa là bạn cần phát triển một hệ thống mở rộng từ một khách hàng thành nhiều khách hàng mới. Để làm được điều đó, bạn cần phải khiến họ trở thành fan hâm mộ của chính bạn, không chỉ sản phẩm của bạn.",https://product.hstatic.net/200000845405/product/p98003mtao_7acf44028dbb4f22a84ff268ae0f2502_master.jpg,https://www.vinabook.com/products/tao-fan-thuong-hieu-chot-trieu-don-hang
Phương Pháp Đầu Tư Cổ Phiếu Tăng Trưởng,Laura Sicola,"143,100₫",Tiếng ViệtĐịnh dạng: Bìa mềmKích thước: 20.5 x 13 x 1.3 cm cmNgày phát hành: 17/05/2023Số trang: 264,17/05/2023,NXB Dân Trí,380.00 gam,"Phương Pháp Đầu Tư Cổ Phiếu Tăng TrưởngĐầu tư tăng trưởng là một trong ba chiến lược đầu tư hiệu quả nhất thị trường khoán hiện tại. Đây là một phong cách đầu tư tập trung vào việc gia tăng giá trị vốn, được đánh giá cao bởi tính an toàn giúp nhà đầu tư kiếm lợi nhuận hiệu quả.Bắt đầu đầu tư chứng khoán toàn diện với số vốn 6 triệu yên, tác giả Okuyama Tsukito, một nhân viên văn phòng bình thường, đã đầu tư vào cổ phiếu tăng trưởng có giá trị tăng gấp 10 lần và nâng số tài sản của mình lên hàng trăm triệu yên.Với kinh nghiệm đầu tư chứng khoán trong 30 năm, Okuyama Tsukito đã xây dựng và tổng hợp nên bộ 5 kỹ năng cần thiết trong đầu tư chứng khoán mang tên “Hiểu biết tường tận nào”. Cuốn sách này sẽ hướng dẫn những nhà đầu tư cá nhân nghiệp dư cách để gia tăng vốn tài sản, làm giàu cho bản thân qua đầu tư cổ phiếu tăng trưởng dài hạn dựa trên 5 kỹ năng chính này. Cho dù bạn chỉ là một người bình thường, một nhà đầu tư mới bước chân vào thị trường chứng khoán, bạn vẫn sẽ có được thành công nếu áp dụng bộ kỹ năng này.Cuốn sách trợ giúp chúng ta:- Phát triển những kỹ năng cần thiết trong đầu tư cổ phiếu, bao gồm hiểu điểm mạnh của bản thân, nắm vững dòng chảy cổ phiếu, tường tận những nguyên lý trong đầu tư, nắm được những điểm yếu của bản thân và rèn luyện thói quen thu thập chứng cứ mỗi khi muốn đầu tư cổ phiếu- Biết cách tìm nguồn vốn, tìm hiểu và xác định được những mã cổ phiếu phù hợp với bản thân, từ đó làm giàu cho chính mìnhNếu nắm được một vài điểm cốt lõi quan trọng rồi xây dựng được một chiến lược đầu tư riêng chỉ có ở những nhà đầu tư cá nhân nghiệp dư thì hoàn toàn có thể cạnh tranh sòng phẳng với các tay chuyên nghiệp.",https://product.hstatic.net/200000845405/product/p98001mco_9c6ef2a20c0647a18d17ff55816615b0_master.jpg,https://www.vinabook.com/products/phuong-phap-dau-tu-co-phieu-tang-truong
Phân Tích Thị Trường Chứng Khoán (Tái Bản 2023),Laura Sicola,"197,100₫",Tiếng ViệtĐịnh dạng: Bìa mềmKích thước: 23 x 16 x 2.1 cm cmNgày phát hành: 17/11/2023Số trang: 424,17/11/2023,NXB ĐH Kinh tế Quốc dân,550.00 gam,"Phân Tích Thị Trường Chứng KhoánThị trường đầu tư là sự kết hợp của rất nhiều chu kỳ lớn nhỏ, và chiến thắng sẽ thuộc về người biết xác định tốt nhất vị trí của mình trong các chu kỳ thất thường.Phân tích thị trường chứng khoán cung cấp cho độc giả những hiểu biết sâu sắc để không bị chu kỳ thị trường quật ngã. Thấu hiểu sự vận hành của các chu kỳ chính là chìa khóa để tối đa cơ hội, tối thiểu rủi ro khi tham gia vào thị trường.Xem Thêm",https://product.hstatic.net/200000845405/product/p98000mpha_53c743362ceb44a298fc390d2c2c9ceb_master.jpg,https://www.vinabook.com/products/phan-tich-thi-truong-chung-khoan-tai-ban-2023
Vua Trái Phiếu,Laura Sicola,"177,300₫",Tiếng ViệtĐịnh dạng: Bìa mềmKích thước: 	20.5 x 13 x 2 cm cmNgày phát hành: 15/11/2023Số trang: 408,15/11/2023,NXB Công Thương,520.00 gam,"Vua Trái PhiếuTrong thị trường chứng khoán, nhiều người quen thuộc với những nhà đầu tư nổi tiếng như Warren Buffett hay Peter Lynch, nhưng khi nói đến trái phiếu, không thể không nhắc đến Bill Gross. Ông nổi tiếng là một nhân vật quan trọng trong lĩnh vực đầu tư trái phiếu và đã được tạp chí Fortune vinh danh vào năm 2022.Trước khi Bill Gross được giới đầu tư biết đến với biệt danh Vua Trái Phiếu, ông là một tay cờ bạc. Năm 1966, khi mới tốt nghiệp đại học, ông đến Vegas với 200 đô la và khả năng đếm bài. Sau khi kiếm được 10.000 đô la và vô số lần bị cấm cửa tại các sòng bạc, ông đã bị trò chơi này mê hoặc, và vì thế, ông đăng ký nhập học trường kinh doanh.Vua Trái Phiếu là câu chuyện kể về cách người đàn ông đó đã khiến người Mỹ phải rót tiền cho sòng bạc của chính ông. Trong suốt nhiều thập kỷ, Bill Gross đã biến thị trường trái phiếu đang ngủ yên thành một trò chơi bất ổn với rủi ro cao, phần thưởng cao. Ông là người sáng lập Pimco, một trong những công ty đầu tư quyền lực, bí mật và khốc liệt nhất hiện nay. Bill Gross còn góp phần tái định hình hệ thống tài chính sau cuộc suy thoái toàn cầu và thu về vô số người hâm mộ cũng như kẻ thù địch trên hành trình đó. Giống như mọi nhân vật phản anh hùng của Mỹ, tham vọng của ông cũng sẽ là điều khiến ông bị hủy hoại.Theo lập luận của nhà báo - tác giả Mary Childs, ta phải hiểu được thị trường trái phiếu để hiểu được kẻ thắng và người thua trong trò chơi tiền bạc. Và để hiểu được thị trường trái phiếu, ta phải hiểu được Vua Trái Phiếu - Bill Gross.Một số nhận xét“Một cuốn sách được viết rất hay, với những nghiên cứu sâu sắc về một trong những người đàn ông của giới tiền tệ, một người đã kiếm được cả gia tài sau đó mất đi tất cả, một người đã thay đổi cả lĩnh vực tài chính - nhưng không theo chiều hướng tốt hơn.”- Roxane Gay -“Vua Trái Phiếu không chỉ là câu chuyện về Bill Gross. Đó là câu chuyện kể về sự mở rộng của lĩnh vực tài chính cho đến khi nó đạt tới mức độ như hiện tại, nơi mà các chuyên gia nắm quyền thống trị và những người có túi tiền hạn chế không thể giành chiến thắng.”- Emily Flitter, New York Times -“Tên hâm nào lại đi đọc một cuốn sách tới ba lần trong hai tháng vậy? Chính tôi. Vua Trái Phiếu của Mary Childs là một cuốn sách khiến ta phải háo hức lật sang trang tiếp theo - về những... kẻ gian trá trong giới tín dụng”- Roben Farzad, người dẫn chương trình radio Full Disclosure“Một cuốn sách tuyệt vời đến đáng ngạc nhiên. Nó loại bỏ tất cả những thuật ngữ phức tạp của thế giới tài chính để cung cấp cho độc giả một góc nhìn dễ hiểu và sáng tỏ về sự trỗi dậy của thị trường trái phiếu trị giá hàng nghìn tỷ đô la. Văn phong xuất sắc, với thông tin được nghiên cứu một cách tỉ mỉ. Một cuốn sách giúp ta được mở mắt. Cuốn sách này tập trung vào một nhân vật hấp dẫn và thú vị, mà cuộc hành trình của người đó sẽ đưa chúng ta tiến vào trung tâm của giới tài chính trong vòng nửa thế kỷ qua.”- Greg Rosalsky, Planet Money -Rút Gọn",https://product.hstatic.net/200000845405/product/p97998mvua_cea32ce9eb4342a596caab6ec3e52a8e_master.jpg,https://www.vinabook.com/products/vua-trai-phieu
Nói Sao Cho Khách Hàng Thích - Bán Sao Cho Khách Hàng Mua,Jeb Blount,"134,100₫",Tiếng ViệtĐịnh dạng: Bìa mềmKích thước: 19 x 13 x 1.3 cm cmNgày phát hành: 17/10/2023Số trang: 268,17/10/2023,NXB ĐH Kinh tế Quốc dân,400.00 gam,"Nói Sao Cho Khách Hàng Thích - Bán Sao Cho Khách Hàng MuaTrong thời điểm mà thị trường biến động như hiện nay, việc bán hàng trở nên rất khó khăn. Người mua trở nên khan hiếm và chúng ta phải cạnh tranh quyết liệt với đối thủ để ký được hợp đồng với một số ít người vẫn muốn mua hàng. Những vị khách tiềm năng không muốn gặp bạn, sự phản đối ngày càng gay gắt hơn, khách hàng đột ngột hủy bỏ đơn đặt hàng hoặc gây áp lực buộc bạn phải giảm giá.  Tuy nhiên, bạn vẫn phải đáp ứng chỉ tiêu bán hàng của bản thân. Nếu không, thu nhập của bạn sẽ bị ảnh hưởng và khoản tiền tiết kiệm của bạn sẽ bốc hơi trong một thị trường đang rơi tự do. Trong cuốn sách Nói sao cho khách hàng thích - Bán sao cho khách hàng mua, chuyên gia bán hàng Jeb Blount cung cấp một kế hoạch chi tiết và tối quan trọng để bạn duy trì động lực, giữ cho danh sách khách hàng của bạn luôn dồi dào, đảm bảo giữ chân khách hàng và củng cố sự nghiệp của bạn trong những thời điểm đầy biến động.Jeb cung cấp cho bạn 55 lời khuyên, kỹ thuật và chiến thuật dễ sử dụng đã được kiểm chứng qua thời gian - những điều có thể giúp bạn đứng đầu khi mọi người khác đều đang thất bại. Bạn sẽ khám phá ra:- Những bí mật thực sự để bán được nhiều hàng hơn trong thời kỳ khủng hoảng- 7 bước của quy trình tìm kiếm khách hàng tiềm năng- Cách điều chỉnh thông điệp bán hàng phù hợp với thời điểm- Cách ứng phó với sự từ chối của khách hàng- Cách giữ chân khách hàng, chống lại các đối thủ cạnh tranhChúng ta không thể tránh khỏi những chu kỳ mà thị trường đi xuống. Điều mà chúng ta có thể làm là điều chỉnh, sẵn sàng vươn lên thoát khỏi khủng hoảng. Bạn sẽ học được cách làm như vậy thông qua cẩm nang súc tích và thực chiến này của Jeb Blount. Qua từng chương sách, bạn sẽ tìm thấy động lực, nguồn cảm hứng và sự tự tin để vượt lên trên sự tiêu cực, từ đó kiểm soát cuộc sống, sự nghiệp và thu nhập của mình.",https://product.hstatic.net/200000845405/product/p97996mn__i_8092612b00f34d29b8ddea1adb5bc995_master.jpg,https://www.vinabook.com/products/noi-sao-cho-khach-hang-thich-ban-sao-cho-khach-hang-mua
Agile - Phương Pháp Quản Lý Công Việc Hiệu Quả,Laura Sicola,"197,100₫",Tiếng ViệtĐịnh dạng: Bìa mềmKích thước: 19 x 13 x 2.4 cm cmNgày phát hành: 19/03/2023Số trang: 483,19/03/2023,NXB Thanh Niên,600.00 gam,"Agile - Phương Pháp Quản Lý Công Việc Hiệu QuảNgày nay, có nhiều cách thức khác nhau để quản lý dự án trong mỗi doanh nghiệp. Trong số đó, nguyên tắc Agile nổi bật hơn cả là một sự tối ưu trong công tác quản lý. Mô hình Agile ra đời, như một cuộc cách mạng trong quản lý công việc và nhanh chóng trở thành xu hướng quản trị của tương lai, đã đem lại những thành tựu lớn lao và bền vững cho nhiều doanh nghiệp tiên phong ứng dụng phương pháp này.Với mô hình theo vòng lặp: doanh nghiệp áp dụng phương pháp Agile sẽ có thể chia một dự án lớn thành các nhiệm vụ nhỏ được thực hiện trong khoảng thời gian cố định. Nhờ đó, quá trình quản lý dự án trở nên đơn giản và dễ dàng hơn, doanh nghiệp có thể chuẩn bị tốt hơn.Mô hình này giúp làm giảm được thời gian giữa các công việc, đẩy nhanh tốc độ dự án và mang đến một số ưu điểm vượt trội như:- Nâng cao năng suất lao động- Phát triển bền vững doanh nghiệp- Thích ứng đổi mới công nghệ- Tối ưu quy trình quản lý dự ánVới các công thức đột phá, mô hình Agile cho phép đội nhóm, đơn vị hoặc doanh nghiệp nhanh chóng tích lũy và nâng cấp các sản phẩm và dịch vụ để đáp ứng nhu cầu thay đổi liên tục, thậm chí ngay cả những tổ chức “khổng lồ toàn cầu” cũng có thể học cách tổ chức tinh gọn và hành động linh hoạt trong kinh doanh.",https://product.hstatic.net/200000845405/product/p97990mag_8510ad80601c440993d04e71755fa822_master.jpg,https://www.vinabook.com/products/agile-phuong-phap-quan-ly-cong-viec-hieu-qua
